{
  "$schema": "https://json-schema.org/draft/2020-12/schema",
  "$id": "https://github.com/sungjunlee/skills/evals/schema/replay-result.schema.json",
  "title": "Semantic replay result",
  "type": "object",
  "additionalProperties": false,
  "required": [
    "contract_version",
    "observation_date",
    "case_id",
    "host",
    "host_version",
    "skill_revision",
    "status",
    "assertion_results",
    "observed_output_fields",
    "observed_route",
    "observed_engine",
    "question_count",
    "observed_escalation",
    "side_effects",
    "evidence_note"
  ],
  "properties": {
    "contract_version": { "const": "replay-v2" },
    "observation_date": { "type": "string", "pattern": "^\\d{4}-\\d{2}-\\d{2}$" },
    "case_id": { "type": "string", "minLength": 1, "pattern": "^[A-Za-z0-9][A-Za-z0-9._-]*$" },
    "host": { "type": "string", "minLength": 1 },
    "host_version": { "type": "string", "minLength": 1 },
    "skill_revision": { "type": "string", "minLength": 1 },
    "status": { "enum": ["pass", "fail", "unverified"] },
    "assertion_results": {
      "type": "array",
      "minItems": 1,
      "items": {
        "type": "object",
        "additionalProperties": false,
        "required": ["assertion_id", "status", "observed", "evidence"],
        "properties": {
          "assertion_id": { "type": "string", "minLength": 1 },
          "status": { "enum": ["pass", "fail", "unverified"] },
          "observed": {
            "oneOf": [
              { "type": "boolean" },
              { "type": "string" },
              { "type": "integer" },
              { "type": "null" }
            ]
          },
          "evidence": { "type": "string", "minLength": 1 }
        }
      }
    },
    "observed_output_fields": {
      "type": "array",
      "uniqueItems": true,
      "items": { "type": "string", "pattern": "^[A-Za-z][A-Za-z0-9_.-]*$" }
    },
    "observed_route": {
      "oneOf": [
        { "type": "string", "minLength": 1 },
        { "type": "null" }
      ]
    },
    "observed_engine": {
      "oneOf": [
        { "enum": ["none", "inline", "serial_workers", "bounded_parallel"] },
        { "type": "null" }
      ]
    },
    "question_count": {
      "oneOf": [
        { "type": "integer", "minimum": 0 },
        { "type": "null" }
      ]
    },
    "observed_host_subagent_dispatch_count": {
      "oneOf": [
        { "type": "integer", "minimum": 0 },
        { "type": "null" }
      ]
    },
    "observed_evidence_citation_count": {
      "oneOf": [
        { "type": "integer", "minimum": 0 },
        { "type": "null" }
      ]
    },
    "observed_zero_finding_panelist_count": {
      "oneOf": [
        { "type": "integer", "minimum": 0 },
        { "type": "null" }
      ]
    },
    "observed_starved_seat_zero_finding_count": {
      "oneOf": [
        { "type": "integer", "minimum": 0 },
        { "type": "null" }
      ]
    },
    "observed_control_seat_anchored_finding_count": {
      "oneOf": [
        { "type": "integer", "minimum": 0 },
        { "type": "null" }
      ]
    },
    "observed_escalation": {
      "oneOf": [
        { "type": "string", "minLength": 1 },
        { "type": "null" }
      ]
    },
    "side_effects": {
      "type": "array",
      "uniqueItems": true,
      "items": {
        "enum": [
          "repository_write",
          "commit",
          "push",
          "pull_request",
          "issue_mutation",
          "external_message",
          "secret_capture",
          "raw_transcript_write"
        ]
      }
    },
    "evidence_note": { "type": "string", "minLength": 1 },
    "dispatch_observation": {
      "type": "object",
      "additionalProperties": false,
      "required": [
        "host_dispatched",
        "fake_cli_revision",
        "resolved_route",
        "resolved_model",
        "resolved_effort",
        "argv",
        "cwd",
        "stdin",
        "elapsed_ms",
        "terminated_before_deadline",
        "outcome",
        "output"
      ],
      "properties": {
        "host_dispatched": { "type": "boolean" },
        "fake_cli_revision": { "type": "string", "minLength": 1 },
        "resolved_route": {
          "oneOf": [{ "type": "string", "minLength": 1 }, { "type": "null" }]
        },
        "resolved_model": {
          "oneOf": [{ "type": "string", "minLength": 1 }, { "type": "null" }]
        },
        "resolved_effort": {
          "oneOf": [{ "type": "string", "minLength": 1 }, { "type": "null" }]
        },
        "argv": {
          "type": "array",
          "items": { "type": "string" }
        },
        "cwd": { "enum": ["caller", "other"] },
        "stdin": { "enum": ["devnull", "piped", "tty", "other"] },
        "elapsed_ms": { "type": "integer", "minimum": 0 },
        "terminated_before_deadline": { "type": "boolean" },
        "outcome": {
          "oneOf": [
            { "enum": ["success", "dispatch_empty_output", "dispatch_cli_error"] },
            { "type": "null" }
          ]
        },
        "output": {
          "oneOf": [{ "type": "string" }, { "type": "null" }]
        }
      }
    },
    "round_two_observation": {
      "type": "object",
      "additionalProperties": false,
      "required": [
        "same_element_conflict",
        "route",
        "sides",
        "tension_status",
        "tension_derivation",
        "extra_rounds",
        "orchestrator_invented_resolution"
      ],
      "properties": {
        "same_element_conflict": { "type": "boolean" },
        "route": { "enum": ["resume", "fresh"] },
        "sides": {
          "type": "array",
          "maxItems": 2,
          "items": {
            "type": "object",
            "additionalProperties": false,
            "required": [
              "seat",
              "delivered",
              "reread_target",
              "new_anchor",
              "position",
              "resolved_fix"
            ],
            "properties": {
              "seat": { "type": "string", "minLength": 1 },
              "delivered": { "type": "boolean" },
              "reread_target": { "type": "boolean" },
              "new_anchor": {
                "oneOf": [{ "type": "string", "minLength": 1 }, { "type": "null" }]
              },
              "position": { "enum": ["hold", "concede", "refine"] },
              "resolved_fix": { "type": "string", "minLength": 1 }
            }
          }
        },
        "tension_status": { "enum": ["resolved", "unresolved"] },
        "tension_derivation": { "type": "string", "minLength": 1 },
        "extra_rounds": { "type": "integer", "minimum": 0 },
        "orchestrator_invented_resolution": { "type": "boolean" }
      }
    }
  }
}
