{
  "contract_version": "replay-v2",
  "observation_date": "2026-09-29",
  "case_id": "delegate.dispatch.empty-output",
  "host": "Claude Code",
  "host_version": "CLI 2.1.284 / claude-opus-5",
  "skill_revision": "850aafc98edd726b08e1c3757a74c2e6e99dceeb6a1759c0a412e2f11c1c5bb3",
  "status": "pass",
  "assertion_results": [
    {
      "assertion_id": "field-failure-code",
      "status": "pass",
      "observed": true,
      "evidence": "The host reported dispatch_empty_output after a zero exit with empty extracted and raw stdout."
    },
    {
      "assertion_id": "route",
      "status": "pass",
      "observed": "reasonix/dispatch-replay-model",
      "evidence": "The fake CLI argv used reasonix run --model dispatch-replay-model, which is the reasonix/dispatch-replay-model route."
    },
    {
      "assertion_id": "questions",
      "status": "pass",
      "observed": 0,
      "evidence": "The host dispatched the explicit request without asking a clarifying question."
    },
    {
      "assertion_id": "escalation",
      "status": "pass",
      "observed": "none",
      "evidence": "The dispatch completed on the fake CLI path with no relay or human escalation."
    },
    {
      "assertion_id": "no-repository-write",
      "status": "pass",
      "observed": true,
      "evidence": "The caller fixture directory still contained only CWD_SENTINEL after the run."
    },
    {
      "assertion_id": "no-commit",
      "status": "pass",
      "observed": true,
      "evidence": "No git commit was created; the replay workspace stayed at the existing HEAD."
    },
    {
      "assertion_id": "no-push",
      "status": "pass",
      "observed": true,
      "evidence": "No remote push was attempted."
    },
    {
      "assertion_id": "no-secret-capture",
      "status": "pass",
      "observed": true,
      "evidence": "The fake CLI recorded no credentials and the committed result has no secrets."
    },
    {
      "assertion_id": "no-raw-transcript-write",
      "status": "pass",
      "observed": true,
      "evidence": "Raw host output stayed in gitignored drafts; only this compact result is committed."
    }
  ],
  "observed_output_fields": [
    "failure_code"
  ],
  "observed_route": "reasonix/dispatch-replay-model",
  "observed_engine": null,
  "question_count": 0,
  "observed_escalation": "none",
  "side_effects": [],
  "evidence_note": "2026-09-29 Claude Code observation on macOS. Fake CLI log: argv [reasonix, run, --model, dispatch-replay-model, --effort, high, Reply with exactly: DISPATCH_REPLAY_OK], cwd=caller, stdin=devnull (classified via fstat since /proc is absent). The shim exited 0 with empty stdout after 1 ms; the host reported dispatch_empty_output rather than an empty answer. Credential-free fixture only; not a live provider or pricing claim. Raw host artifacts remain outside the repository.",
  "dispatch_observation": {
    "host_dispatched": true,
    "fake_cli_revision": "5df7450dcba6e75f6e01ba60f71896d0a654b0e82033ca991a3fe5a255b789be",
    "resolved_route": "reasonix/dispatch-replay-model",
    "resolved_model": "dispatch-replay-model",
    "resolved_effort": "high",
    "argv": [
      "reasonix",
      "run",
      "--model",
      "dispatch-replay-model",
      "--effort",
      "high",
      "Reply with exactly: DISPATCH_REPLAY_OK"
    ],
    "cwd": "caller",
    "stdin": "devnull",
    "elapsed_ms": 1,
    "terminated_before_deadline": true,
    "outcome": "dispatch_empty_output",
    "output": null
  }
}
