{
  "contract_version": "replay-v2",
  "observation_date": "2026-09-02",
  "case_id": "feature-spec.neutral-multi-leaf-decomposition",
  "host": "Codex",
  "host_version": "codex-cli 0.146.0 / gpt-5.6-sol",
  "skill_revision": "54967bfc8f733d7fe30a21c5fe31848bfa1791387c9767518c78df80d8dbda5e",
  "status": "pass",
  "assertion_results": [
    {
      "assertion_id": "handoff",
      "status": "pass",
      "observed": true,
      "evidence": "The compiled spec contains Decomposition-Handoff."
    },
    {
      "assertion_id": "leaves",
      "status": "pass",
      "observed": true,
      "evidence": "The compiled spec contains Leaf-boundaries."
    },
    {
      "assertion_id": "edges",
      "status": "pass",
      "observed": true,
      "evidence": "The compiled spec contains Dependency-edges."
    },
    {
      "assertion_id": "shared-ac",
      "status": "pass",
      "observed": true,
      "evidence": "The compiled spec contains Shared-acceptance-criteria."
    },
    {
      "assertion_id": "handoff-shape",
      "status": "pass",
      "observed": "decomposition",
      "evidence": "Observed handoff shape \"decomposition\"."
    },
    {
      "assertion_id": "no-question",
      "status": "pass",
      "observed": 0,
      "evidence": "Observed 0 blocking question(s)."
    },
    {
      "assertion_id": "no-escalation",
      "status": "pass",
      "observed": "none",
      "evidence": "Observed escalation \"none\"."
    },
    {
      "assertion_id": "no-successor-invocation",
      "status": "pass",
      "observed": true,
      "evidence": "No external_message observed in the fixture repository."
    },
    {
      "assertion_id": "no-tracker-mutation",
      "status": "pass",
      "observed": true,
      "evidence": "No issue_mutation observed in the fixture repository."
    },
    {
      "assertion_id": "no-write",
      "status": "pass",
      "observed": true,
      "evidence": "No repository_write observed in the fixture repository."
    }
  ],
  "observed_output_fields": [
    "Artifact-lifetime",
    "Decomposition-Handoff",
    "Suggested-path",
    "Response-body",
    "Unresolved-human-decisions",
    "Leaf-boundaries",
    "Dependency-edges",
    "Shared-acceptance-criteria"
  ],
  "observed_route": "decomposition",
  "observed_engine": null,
  "question_count": 0,
  "observed_escalation": "none",
  "side_effects": [],
  "evidence_note": "2026-09-02 isolated Codex CLI replay in a disposable fixture repository; exit 0; fixture HEAD unchanged; spec/ untouched. Tool-neutral Decomposition Handoff; tracked tree unchanged; no successor invocation or tracker mutation. Raw artifacts stay outside the repository."
}
