{
  "contract_version": "replay-v2",
  "observation_date": "2026-08-16",
  "case_id": "fixture.dispatch-success",
  "host": "fixture-host",
  "host_version": "schema-smoke-v1",
  "skill_revision": "a5d980fa21ea799d4c4f5c1c8706eaf77c30f78e43f5355535ea73b962959883",
  "status": "pass",
  "assertion_results": [
    {
      "assertion_id": "field-output",
      "status": "pass",
      "observed": true,
      "evidence": "Synthetic output-field observation."
    },
    {
      "assertion_id": "route",
      "status": "pass",
      "observed": "reasonix/dispatch-replay-model",
      "evidence": "Synthetic route observation."
    },
    {
      "assertion_id": "questions",
      "status": "pass",
      "observed": 0,
      "evidence": "Synthetic question-count observation."
    },
    {
      "assertion_id": "escalation",
      "status": "pass",
      "observed": "none",
      "evidence": "Synthetic escalation observation."
    }
  ],
  "observed_output_fields": [
    "output"
  ],
  "observed_route": "reasonix/dispatch-replay-model",
  "observed_engine": null,
  "question_count": 0,
  "observed_escalation": "none",
  "side_effects": [],
  "evidence_note": "Synthetic dispatch-contract verifier smoke evidence; no host support claim.",
  "dispatch_observation": {
    "host_dispatched": true,
    "fake_cli_revision": "fixture",
    "resolved_route": "reasonix/dispatch-replay-model",
    "resolved_model": "dispatch-replay-model",
    "resolved_effort": "high",
    "argv": [
      "reasonix",
      "run",
      "-m",
      "dispatch-replay-model",
      "--effort",
      "high",
      "Reply with exactly: DISPATCH_REPLAY_OK"
    ],
    "cwd": "caller",
    "stdin": "devnull",
    "elapsed_ms": 12,
    "terminated_before_deadline": true,
    "outcome": "success",
    "output": "DISPATCH_REPLAY_OK"
  }
}
