{
  "contract_version": "replay-v2",
  "observation_date": "2026-09-08",
  "case_id": "fixture.round-two-trace",
  "host": "synthetic",
  "host_version": "fixture",
  "skill_revision": "f16d05ec6b29248d2c61adb1e9263f78e4f7bace1b955014a2d17872cfe4064d",
  "status": "fail",
  "assertion_results": [
    {
      "assertion_id": "field-summary",
      "status": "pass",
      "observed": true,
      "evidence": "Synthetic output-field observation."
    },
    {
      "assertion_id": "host-dispatch-count",
      "status": "pass",
      "observed": 4,
      "evidence": "Synthetic host dispatch count for verifier coverage; no host support claim."
    },
    {
      "assertion_id": "engine-bounded-parallel",
      "status": "pass",
      "observed": "bounded_parallel",
      "evidence": "Synthetic engine observation."
    },
    {
      "assertion_id": "escalation-none",
      "status": "pass",
      "observed": "none",
      "evidence": "Synthetic escalation observation."
    }
  ],
  "observed_output_fields": [
    "summary"
  ],
  "observed_route": null,
  "observed_engine": "bounded_parallel",
  "question_count": null,
  "observed_host_subagent_dispatch_count": 4,
  "observed_escalation": "none",
  "side_effects": [],
  "evidence_note": "Synthetic fixture-premise-invalid path: the first panel never produced a same-element opposite-fix conflict, so the result cannot pass.",
  "round_two_observation": {
    "same_element_conflict": false,
    "route": "fresh",
    "sides": [],
    "tension_status": "unresolved",
    "tension_derivation": "No same-element opposite-fix pair existed, so no round ran.",
    "extra_rounds": 0,
    "orchestrator_invented_resolution": false
  }
}
