{
  "contract_version": "replay-v2",
  "observation_date": "2026-09-08",
  "case_id": "gosu-review.evidence-anchored-panel",
  "host": "Claude Code",
  "host_version": "CLI 2.1.263 / claude-opus-5[1m]",
  "skill_revision": "60c744a27bccab0f6f03ff4a10f985f2588f5548",
  "status": "pass",
  "assertion_results": [
    {
      "assertion_id": "field-target",
      "status": "pass",
      "observed": true,
      "evidence": "The selected target was echoed near the top of the output as LAYOUT.md."
    },
    {
      "assertion_id": "field-casting",
      "status": "pass",
      "observed": true,
      "evidence": "A one-line casting summary named two specialized, one quality, one adversarial, and one simplifier seat."
    },
    {
      "assertion_id": "field-verdicts",
      "status": "pass",
      "observed": true,
      "evidence": "One verdict line per panelist preceded the detailed panel section."
    },
    {
      "assertion_id": "field-panel",
      "status": "pass",
      "observed": true,
      "evidence": "Five panel entries appeared, each attributed to the subagent that returned it and each carrying findings and a falsifier."
    },
    {
      "assertion_id": "field-meta-requested",
      "status": "pass",
      "observed": true,
      "evidence": "Meta reported five agents requested."
    },
    {
      "assertion_id": "field-meta-returned",
      "status": "pass",
      "observed": true,
      "evidence": "Meta reported five returned, matching the five entries shown."
    },
    {
      "assertion_id": "field-meta-tool",
      "status": "pass",
      "observed": true,
      "evidence": "Meta named the host Agent tool actually used."
    },
    {
      "assertion_id": "evidence-citations",
      "status": "pass",
      "observed": 20,
      "evidence": "Twenty findings across five entries, each carrying a LAYOUT.md:line reference or a quotation from the target; counted from the rendered panel, not from orchestrator prose."
    },
    {
      "assertion_id": "engine-bounded-parallel",
      "status": "pass",
      "observed": "bounded_parallel",
      "evidence": "All five panelists were dispatched before any of those five results was read."
    },
    {
      "assertion_id": "no-confirmation-question",
      "status": "pass",
      "observed": 0,
      "evidence": "The target was named explicitly, so no confirmation question was asked."
    },
    {
      "assertion_id": "escalation-none",
      "status": "pass",
      "observed": "none",
      "evidence": "Every dispatched panelist returned; nothing degraded."
    },
    {
      "assertion_id": "no-repository-write",
      "status": "pass",
      "observed": true,
      "evidence": "The disposable fixture repository remained clean after the run."
    },
    {
      "assertion_id": "no-commit",
      "status": "pass",
      "observed": true,
      "evidence": "The fixture HEAD remained the seed commit."
    },
    {
      "assertion_id": "no-push",
      "status": "pass",
      "observed": true,
      "evidence": "The fixture had no remote and no push was attempted."
    }
  ],
  "observed_output_fields": [
    "target",
    "casting",
    "verdicts",
    "panel",
    "meta.requested",
    "meta.returned",
    "meta.tool"
  ],
  "observed_route": null,
  "observed_engine": "bounded_parallel",
  "question_count": 0,
  "observed_evidence_citation_count": 20,
  "observed_zero_finding_panelist_count": 0,
  "observed_escalation": "none",
  "side_effects": [],
  "evidence_note": "Same 2026-09-08 panel as gosu-review.cross-examined-tension.claude-code.json, recorded here for the depth counters. Twenty of twenty findings carried an anchor. Zero panelists returned an empty finding list because the conflict fixture is defect-rich; that is a target-selection limit, not evidence about the forced-finding path. Codex remains unverified on this date because ChatGPT usage limit blocked exec, so evidence_citation_count_in_range is still uncounted on Codex."
}
